Date,Headline
2022-05-12,Funeral de Estado para la periodista palestina asesinada por Israel
2022-05-12,Ejército ruso mata a 170 nacionalistas ucranianos en Donetsk
2022-05-12,¿Hezbolá y HAMAS destruirán los “carros de fuego” de Israel?
2022-05-12,General estadounidense: Atacaremos Afganistán “si vemos amenazas”
2022-05-12,Putin alerta que medidas de Occidente generarán una crisis mundial
2022-05-12,Alcharani: A Israel no le importan los palestinos ni la ley internacional
2022-05-12,Ecuador desarrolla lazos con Israel y abre oficina comercial en Al-Quds
2022-05-12,Luque: Catar tiene una “posición fuerte” en respaldo a Irán
2022-05-12,Venezuela condena ‘injustificado’ asesinato de periodista de Al Jazeera
2022-05-12,Fuerzas bielorrusas llevan a cabo simulacros en la frontera con Ucrania
2022-05-12,Líder de Irán: El mundo árabe debe hacer frente a crímenes de Israel
2022-05-12,Israel aprueba construcción de 4400 viviendas ilegales en Cisjordania
2022-05-12,Rublo ruso se convierte en la divisa líder por su gran rendimiento
2022-05-12,EEUU elabora guía para intercambio de datos de inteligencia con Ucrania
2022-05-12,Rusia amenaza a Finlandia con respuesta ‘técnico-militar’ si entra en OTAN